G_ID,G_TITLE,A_ID,A_TITLE
http://www.google.com/base/feeds/snippets/18422752499559886630,panda software upg to cltshld 2006 trupr ev cltshld 51-100 1yr - ub1cs6c-gov,b000v05f4k,panda software antivirus & firewall 2008 - windows
http://www.google.com/base/feeds/snippets/18423412970630780827,emedia eg04025 intermediate guitar method - complete package,b0000696oh,emedia intermediate guitar method win/mac
http://www.google.com/base/feeds/snippets/18424247759201075212,emedia eg03014 bass method os x,b000162zq0,emedia bass method win/mac
http://www.google.com/base/feeds/snippets/18421124335830202729,panda software ae gatedef 8100 antispam mod 251-500u 3yr - b3pgdbase-edu,b000v05f4k,panda software antivirus & firewall 2008 - windows
http://www.google.com/base/feeds/snippets/18422068306669698354,microsoft h22-00301 gov open sa project svr w9x nt,b0006g2wke,microsoft licenses project svr sa govt (h2200301)
http://www.google.com/base/feeds/snippets/18422266773656246362,total training for adobe creative suite 3 design premium,b000qs8n64,total training for adobe creative suite 3: design premium bundle
http://www.google.com/base/feeds/snippets/18433022834718595255,nuance communications inc. upgrade to dragon naturallyspeaking v8 legal solutions from professional v6 and up (govt) olp - a590a-sf2-8.0,b000gzwjgc,acad upgrade dragon naturallyspeaking pro solution 9.0 (a289a-fd7-9.0)
http://www.google.com/base/feeds/snippets/18420491833696681736,got game entertainment - exclusive - 00050 - scratches: directors cut,b000kmcf0g,scratches: directors cut
http://www.google.com/base/feeds/snippets/18420557141798984679,language guide for nuvi 350,b000nkklwy,power translator 11 premium
http://www.google.com/base/feeds/snippets/18418631443367666576,csdc x3mac x3: reunion - virtual programming ltd. mac 10.4 or later ub,b000ozibhk,x3: reunion - virtual programming ltd.
http://www.google.com/base/feeds/snippets/18417354130985846422,autocad 2007 coursewarecustomizing the interface,b000hkgj8k,autocad 2007 courseware customizing the interface
http://www.google.com/base/feeds/snippets/18418227076783326972,panda software clientshield 2006 w/ truprevent 5-25 1yr - b1cs6a-gov,b000v05f4k,panda software antivirus & firewall 2008 - windows
http://www.google.com/base/feeds/snippets/18417864141770237281,sonicwall 01-ssc-2574,b000040p1z,sonicwall internet upgrade (50-node)
http://www.google.com/base/feeds/snippets/18416225624614818879,avid technology inc. 70102024701 - software avid liquid chrome xe,b000e0v924,avid liquid vs 7 software
http://www.google.com/base/feeds/snippets/18416188802563653999,microsoft 164-04052,b000hcz8ey,microsoft onenote 2007
http://www.google.com/base/feeds/snippets/18415868157206410032,panda software govt truprevent corp 2001-3ku 2yr - b2prseh-gov,b000v05f4k,panda software antivirus & firewall 2008 - windows
http://www.google.com/base/feeds/snippets/18417395795614971102,symantec 11281445 - antivirus v.10.2 business pack - complete product - antivirus - 100 user - complete product - standard - pc- free shipping,b000exu6cu,symantec client security 3.1 with groupware protection business pack 50 user
http://www.google.com/base/feeds/snippets/18416264451031093966,microsoft windows vista business - 32-bit oem,b000mfgx7w,microsoft windows vista business 32-bit for system builders
http://www.google.com/base/feeds/snippets/18416260775952371893,iriscard pro,b000f7ixx4,iriscard pro business card scanner
http://www.google.com/base/feeds/snippets/18414674514314244954,panda software ae bus sec ex truprevent 3001-5ku 3yr - b3pbsepri-edu,b000v05f4k,panda software antivirus & firewall 2008 - windows
http://www.google.com/base/feeds/snippets/18414778073602422524,coreldraw graphics suite x3 upgrade windows,b000dinb4g,coreldraw graphics suite x3 upgrade
http://www.google.com/base/feeds/snippets/18413398528673669489,the stevie wonder collection,b0002h6x34,reader rabbit preschool
http://www.google.com/base/feeds/snippets/18413484739795948632,absolute software - lfl-n2-48 - computrace lojack for laptops - 4 year license,b000gcd6lw,computrace lojack for laptops - 3 year license (mac)
http://www.google.com/base/feeds/snippets/18412806770198800753,symantec 11105975 - backup exec 11d for windows servers business pack bundle - w/ continuous protection server - complete package + 1 year essential support - 1 server - buying programs : business pack - cd - win - multi,b000keho1e,symc backup exec sbs std 11d win small business server standard
http://www.google.com/base/feeds/snippets/18413075895200367717,microsoft 392-02322 ae frontpage 2003,b000hcz8ey,microsoft onenote 2007
http://www.google.com/base/feeds/snippets/18428018889032699615,viva media llc 00257 - my sim aquarium - win 2000 xp vista,b000f613x2,my sim aquarium
http://www.google.com/base/feeds/snippets/18411107872300792105,cakewalk 10-cwgp3.00-90c - guitar tracks pro 3.0 (3 win 00/xp cd),b0002e3lpk,pc cakewalk guitar tracks pro 3
http://www.google.com/base/feeds/snippets/18415197771734313133,adobe 38040450 - dreamweaver cs3 - complete product - web development - 1 user - complete product - academic - universal english - mac intel-based mac,b000ndid62,adobe dreamweaver cs3 upgrade [mac]
http://www.google.com/base/feeds/snippets/18411046341072063935,instant immersion italian audio (audio book),b000j4k804,instant immersion spanish (audio book)
http://www.google.com/base/feeds/snippets/18409957880168870961,myinvoices & estimates deluxe,b000hysu2y,myinvoices & estimates deluxe
http://www.google.com/base/feeds/snippets/18409822956112890125,destineer inc 10316 - destineer atari arcade classics - action/adventure - mac,b0009jgv50,john deere: busy days in deerfield valley
http://www.google.com/base/feeds/snippets/18408932251043665247,adobe after effects (v7.0) pro mac up pro-pro - adobe - 12070227,b000o26lo8,adobe after effects cs3 upgrade
http://www.google.com/base/feeds/snippets/18409154395025279191,adobe 09951404 solution expert annu all,b0002735fi,adobe solution expert support
http://www.google.com/base/feeds/snippets/18406867413031084183,adobe creative suite (v3.0) design premium mac - adobe - 19500009,b000ndibri,adobe creative suite cs3 design premium [mac]
http://www.google.com/base/feeds/snippets/18406653450238248367,listen for ipod - magnetic time (win 2000 xp),b000lu8a10,listen for ipod - magnetic time
http://www.google.com/base/feeds/snippets/18406229737596409253,watchguard wg017091 fb x 3 port & high avail upg,b0002t867s,watchguard 1yr subs firebox x5 webblocker ( wg017196 )
http://www.google.com/base/feeds/snippets/18406000514365649458,encore 28008 cold zero,b00006h38u,cold zero: no mercy
http://www.google.com/base/feeds/snippets/18405769282316939471,mcsa/mcse self-paced training kit (exams 70-292 and 70-296) upg. your,b0000ca2ix,mcsa/mcse self-paced training kit (exams 70-292 & 70-296) - upgrading your certi
http://www.google.com/base/feeds/snippets/18405745276041721942,britannica deluxe 2008,b000hedyio,britannica deluxe
http://www.google.com/base/feeds/snippets/18405362244680246986,microsoft r39-00292 open win svr 2003 ext conn,b0006g31i6,microsoft licenses win svr 2003 ext conn lic (r3900292)
http://www.google.com/base/feeds/snippets/18405135648098652581,fogware publishing - 10356 - high school us history 2 - foreign policy & reform,b000g017kg,foreign policy & reform (win/mac) (jewel case)
http://www.google.com/base/feeds/snippets/18405058220481329541,hoyle solitaire,b000lu89uc,hoyle south beach solitaire
http://www.google.com/base/feeds/snippets/18404319188505755669,topics entertainment topics entertainment play electric guitar deluxe windows,b0009y6f0g,instant play electric guitar deluxe
http://www.google.com/base/feeds/snippets/18404187604346548446,buzby; breakin all the rules hermie and freinds- digital pr,b000ek6ekq,buzby breakin' all the rules hermie and friends
http://www.google.com/base/feeds/snippets/18404168006486239466,adobe systems inc - 29180248 - adobe photoshop elements 5.0/premiere elements 3.0,b000hlp5do,adobe photoshop elements 5.0/premier elements 3.0 [lb]
http://www.google.com/base/feeds/snippets/10432571578455910310,cisco csa-b100-srvr-k9 cisco security server agent win + sol 100 agentbundle cisco security server agent - license - 100 agents - win solaris 0746320832586,b00008mopv,cisco security server agent for windows and solaris - license - 100 agents - win solaris ( csa-b100-srvr-k9 )
http://www.google.com/base/feeds/snippets/12962968220446257144,rl296aa red hat enterprise linux ws - ( v. 4 update 4 ) - license - 1 workstation,b000jqv8t2,red hat enterprise linux ws - ( v. 4 update 4 ) - license - 1 workstation ( rl296aa )
http://www.google.com/base/feeds/snippets/652180243683892646,microsoft ov l/sa prj ext conn ul 3yr/acqyr1 - t76-01189,b0006g31ao,microsoft licenses exch. srvr extrn conn sa eng (39400416)
http://www.google.com/base/feeds/snippets/12994019030325848337,t3586a hp storageworks secure path for linux workgroup edition - ( v. 3.0c ) - license,b0000dzfvd,hp storageworks secure path for windows workgroup edition - ( v. 4.0c ) - license ( 213076-b26 )
http://www.google.com/base/feeds/snippets/18442437439289118179,avanquest usa 1461 system suit 7 professional,b000ik9s00,vcomm system suite professional 7
http://www.google.com/base/feeds/snippets/18443105453266961029,master server-upg,b000eavbdq,master server-upg
http://www.google.com/base/feeds/snippets/18444171148464728826,atari 26162 crusader kings mb,b0002w37x8,crusader kings
http://www.google.com/base/feeds/snippets/18444799765271946003,norton internet security (v3.0) mac - symantec - 10069614-in,b00009qenn,norton internet security mac 3.0 [antivirus firewall privacy controls iclean]
http://www.google.com/base/feeds/snippets/18445026451868718668,masque 10192 slots from bally gaming,b000iflerk,sportsman's double play
http://www.google.com/base/feeds/snippets/18445341039052694828,microsoft 394-00416 opens exch svr exconn l/sa qual,b0006g31ao,microsoft licenses exch. srvr extrn conn sa eng (39400416)
http://www.google.com/base/feeds/snippets/12914622085255786621,bablur1150s06 brightstor arcserve backup enterprise option for advantage ingres for linux - (,b000ayznhg,ca brightstor arcserve backup r11.5 for enterprise option for advantage ingres for
http://www.google.com/base/feeds/snippets/18445465727364031756,business objects crystal reports xi,b000b5rweg,upgrade crystal reports 11 pro french
http://www.google.com/base/feeds/snippets/18445827127704822533,sierrahome hse hallmark card studio special edition win 98 me 2000 xp,b000bndghk,hallmark card studio 2006
http://www.google.com/base/feeds/snippets/18446496383812786183,cookn vegetarian,b000056b62,cook'n vegetarian
http://www.google.com/base/feeds/snippets/18446475323980311026,symantec backup exec 11d for windows servers agent for lotus domino server - complete package,b000kehnvu,symc backup exec aofo 11d win advanced open file option
http://www.google.com/base/feeds/snippets/18446612824766852081,hidden expedition: titanic,b000fbk6gc,hidden expedition: titanic
http://www.google.com/base/feeds/snippets/12852968287224775140,c8d-00006 microsoft dynamics crm small business edition - ( v. 3.0 ) - license - 20 user c,b000bta4kg,microsoft crm small business ed cal 3.0 license pack user cal
http://www.google.com/base/feeds/snippets/16821958940203637711,microsoft h32-00034 sps extrnlconnnonemplyengl&s c 805529073074,b0006g2zce,microsoft licenses sps extrnlconnnonemplyenglands c (h3200034)
http://www.google.com/base/feeds/snippets/18437095181150491754,microsoft t07-00336 ae open crm l/sa ste std usr qual,b0001wn0m2,microsoft office 2004 standard (mac)
http://www.google.com/base/feeds/snippets/18436637620422411542,microsoft e32-00575 - sql server 2005 developer edition x64 - complete product - dbms - 1 developer(s) - complete product - standard - english - pc,b000bhq5jw,microsoft sql server developer edition 2005 cd/dvd
http://www.google.com/base/feeds/snippets/18435579466587005010,microspot interiors (mac 10.2 or later),b000csramg,microspot interiors (mac)
http://www.google.com/base/feeds/snippets/18435954901092427938,procurve vpn client software unlimited client licenses,b0009hmx36,procurve vpn client software unlimited client licenses
http://www.google.com/base/feeds/snippets/18435517580056006507,pantone gps206 - reference library,b000e6q3em,pantone reference library
http://www.google.com/base/feeds/snippets/18438098517069192631,adobe 42050142 acrobat distiller 6 lnx ret cd u/l lnx,b0000y7wc0,adobe acrobat distiller svr v6-cd linux u/u ( 42050142 )
http://www.google.com/base/feeds/snippets/18438075297130458214,encore tlc dr seuss reading learning system 2008,b000ozhfsq,tlc dr. seuss reading learning system 2008
http://www.google.com/base/feeds/snippets/13442788600745771907,s65-00393 microsoft virtual pc for mac - ( v. 7.0 ) - w/ windows 2000 - complete package -,b0002nt34o,microsoft virtual pc for mac 7.0 with windows 2000
http://www.google.com/base/feeds/snippets/18437217832073898346,panda software active scan pro esd 1yr - bpasp12m,b000v05f4k,panda software antivirus & firewall 2008 - windows
http://www.google.com/base/feeds/snippets/18437163602958068440,panda software upg to gatdef performa 8200 4k0 1yr - uabpgdpcavs-edu,b000v05f4k,panda software antivirus & firewall 2008 - windows
http://www.google.com/base/feeds/snippets/18440108050883260642,panda software enterprisecure truprevent 101-250u 3yr - ub3prpesad,b000in4uak,panda internet security 2007 3-user
http://www.google.com/base/feeds/snippets/18439765091608018992,allume systems moa-w40-dem-r,b000bljed2,allume aquazone seven seas deluxe
http://www.google.com/base/feeds/snippets/18439531339127707571,microsoft winvista bus upsa 1y acq y3 ent w/visent - 66j-01685,b000mfgx7w,microsoft windows vista business 32-bit for system builders
http://www.google.com/base/feeds/snippets/18439285252319697866,thq 36118 - danny phantom: urban jungle - action/adventure game - nintendo ds,b00006j02n,matchbox cross-town heroes
http://www.google.com/base/feeds/snippets/13334741327257129475,124-00458 microsoft visual studio team edition 2005 for software developers - complete pac,b000bawkpm,microsoft visual studio team edition for software developers 2005 with msdn premium
http://www.google.com/base/feeds/snippets/18441655151227442425,panda software clientshield 2006 3001-5k 2yr - b2cs6si-gov,b000v05f4k,panda software antivirus & firewall 2008 - windows
http://www.google.com/base/feeds/snippets/18441480711193821750,clickart 950000 - premier image pack (dvd-rom),b000jz4hqo,clickart 950 000 - premier image pack (dvd-rom)
http://www.google.com/base/feeds/snippets/18441188461196475272,sage (ptree) - vernfp2007rt - premium accounting for nonprofits 2007,b000g80lqo,peachtree by sage premium accounting for nonprofits 2007
http://www.google.com/base/feeds/snippets/18441110047404795849,the beginners bible: noah's ark activity center: activity center,b00006oaqv,reader rabbit learn to read phonics pre kindergarten
http://www.google.com/base/feeds/snippets/13368550084570344351,c8a-00066 microsoft dynamics crm professional - ( v. 3.0 ) - product upgrade license - 20,b000bta4k6,microsoft crm professional cal 3.0 product upgrade license pack user cal
http://www.google.com/base/feeds/snippets/18431827533263730235,nuance dragon naturallyspeaking v.9.0 professional - upgrade,b000gzwjgc,acad upgrade dragon naturallyspeaking pro solution 9.0 (a289a-fd7-9.0)
http://www.google.com/base/feeds/snippets/18430618972729825710,print explosion deluxe 3.0: mac,b000exu9ay,print explosion deluxe 3.0 (mac)
http://www.google.com/base/feeds/snippets/18429753124273270900,knowledge adventure 785105 jumpstart explore-gr1-3 add on,b000i84dts,jumpstart world 1st grade
http://www.google.com/base/feeds/snippets/18431066094306345892,epson s041886 epson - epson storyteller photo book creator - w/ 8in x 10in book with 20 pages - complete package - 1 user - std - win,b0007yll20,epson storyteller photo book creator - 8 x 10 (20 pages)
http://www.google.com/base/feeds/snippets/18430621475529168165,adobe software 22070152 after effects 6.5 pbupgrd,b00021xhzw,adobe after effects professional 6.5 upgrade from standard to professional
http://www.google.com/base/feeds/snippets/18431383104785501737,adobe systems 27910468 adobe framemaker v.7.2 - complete product - desktop publishing - 1 user - complete product - standard - english - pc plus $10 off w/ ebillme *free shipping*,b000ndibnc,adobe creative suite cs3 design standard upsell [mac]
http://www.google.com/base/feeds/snippets/18431790997623472871,disney learning 1st-2nd grade win,b00029bqa2,disney's 1st & 2nd grade bundle (pixar 1st grade secret keys and aladdin reading quest)
http://www.google.com/base/feeds/snippets/18434163358494173665,kutoka interactive 61208 mia's math adventure: just in time!,b0000dbykm,mia's math adventure: just in time
http://www.google.com/base/feeds/snippets/18433413888105089937,nova development ghw humorous greeting card factory,b0000c7gep,humorous greeting card factory
http://www.google.com/base/feeds/snippets/18434733520229761009,paper art volume 2: gift wrapping,b0007prnjo,paper art: gift wrapping
http://www.google.com/base/feeds/snippets/18435241901201099210,punch software - 85100 - master landscape professional & home design v 10.0,b000enucs8,punch! master landscape professional & home design v 10.0
http://www.google.com/base/feeds/snippets/18434385825570199468,microsoft windows services for netware - ( v. 5.0 ) - complete package,b00004nhn7,services for netware 5.0
http://www.google.com/base/feeds/snippets/18434262004669557918,webroot software inc - 31250 - spy sweeper spanish,b000i82j80,spy sweeper spanish
http://www.google.com/base/feeds/snippets/18434616791723899127,omnioutliner professional 3.0 for mac,b000in6u62,omnioutliner professional 3.0
http://www.google.com/base/feeds/snippets/15463023861103191894,microsoft molpc isa svr ent ed 2006 25cpu lic 200pt - f89-01407,b0006g31ao,microsoft licenses exch. srvr extrn conn sa eng (39400416)
http://www.google.com/base/feeds/snippets/16621550764866327052,cisco security server agent (windows and solaris) 100-agent bundle,b00008mopv,cisco security server agent for windows and solaris - license - 100 agents - win solaris ( csa-b100-srvr-k9 )
http://www.google.com/base/feeds/snippets/11946393152895467344,microsoft 394-00258 exchsrvrextrncon lic/sa c 400p 805529357631,b0006g31ao,microsoft licenses exch. srvr extrn conn sa eng (39400416)
http://www.google.com/base/feeds/snippets/3409784122469217433,sonicwall gms 1000n-incremental lic upg,b0000swyw4,sonicwall gms standard edition 10 node license
http://www.google.com/base/feeds/snippets/9687887699930800156,sonicwall gms 1000 upgrade,b000040p1z,sonicwall internet upgrade (50-node)
http://www.google.com/base/feeds/snippets/17922590680219981437,hewlett packard 231319-b26 secure path v4.0c for windows workgroup ed 50u lics & media 0808736757386,b0000dzfvd,hp storageworks secure path for windows workgroup edition - ( v. 4.0c ) - license ( 213076-b26 )
http://www.google.com/base/feeds/snippets/13598501353144283116,hewlett packard t3558a secure path hp-ux we 50 lic/cd kit 0829160172255,b0001y7poo,hp sp linux we 50 lic/cd 3.0c ( t3586a )
http://www.google.com/base/feeds/snippets/5032391174084349054,media made easy volume 3,b000jj4fbw,emedia essential bass guitar
http://www.google.com/base/feeds/snippets/10418439495918475369,individual software pmm-ss4 - professor teaches office super set - win 2000 xp vista,b000edjjhs,individual small business advantage deluxe 2006
http://www.google.com/base/feeds/snippets/4188176128903497851,topics presents:dinosaurs,b0000ycfdq,dinosaurs
http://www.google.com/base/feeds/snippets/4783370532123880956,instant home design 3.0,b0007yepy6,instant home design 3.0 [lb]
http://www.google.com/base/feeds/snippets/14590739388057248882,punch software 26100 punch! master landscape and home design (small box),b00005aycg,punch! master landscape & home design
http://www.google.com/base/feeds/snippets/13718013650982127815,encore software 10590 - adventure workshop preschool 1st grade 7th ed sb cs by riverdeep,b000gkpds8,adventure workshop 4th-6th grade 7th ed sb cs by riverdeep
http://www.google.com/base/feeds/snippets/13990215962326719230,encore software 10941 - scooby-doo frights camera mystery sb cs by riverdeep,b000gkpds8,adventure workshop 4th-6th grade 7th ed sb cs by riverdeep
http://www.google.com/base/feeds/snippets/14235968984166622494,enfocus software pp7.0-sg-001 - pitstop pro 7.0,b000g0lkcg,pitstop pro 7.0
http://www.google.com/base/feeds/snippets/14520556770161082452,encore software 10731 - the print shop 22 pro publisherdeluxe sb cs by the print shop,b000he9psc,the print shop 22 pro publisher deluxe sb cs by the print shop
http://www.google.com/base/feeds/snippets/12644706112820906522,encore software 10871 - family tree maker version 16 deluxe sb cs by family tree maker,b000h20hu4,family tree maker version 16 deluxe
http://www.google.com/base/feeds/snippets/6723971893365194031,apple ilife 06,b0007lw23a,apple iwork '06 (mac dvd)
http://www.google.com/base/feeds/snippets/13289023771526506121,encore software 11581 - monopoly deluxe edition by hasbro,b000hhxeuo,monopoly platinum edition
http://www.google.com/base/feeds/snippets/13312621869477195220,encore software 11041 - the print shop elements: labels& logos sb cs by the print shop,b000pg8kxs,the print shop elements: labels & logos sb cs by the print shop
http://www.google.com/base/feeds/snippets/13561992178364532313,encore software 10467 - clickart 950k dvd 2006 by broderbund,b000fjs8sc,clickart 1.2 million dvd 2006 by broderbund
http://www.google.com/base/feeds/snippets/16909088683747633392,encore software 12431 - adventure workshop 8 4th-6th,b000ffsgho,adventure workshop 4th-6th grade 7th edition
http://www.google.com/base/feeds/snippets/1035187390817409083,mavis beacon teaches typing 16 deluxe,b0001gu7di,mavis beacon teaches typing deluxe 16
http://www.google.com/base/feeds/snippets/16962004016081153467,enfocus software ip4.0-sg-001 - instantpdf 4.0 single full,b000g0oom4,pitstop pro 7.0 upgr - 6.x or higher
http://www.google.com/base/feeds/snippets/1417708435719198149,x-oom internet movies 2,b000cpmtwk,x-oom internet movies 2
http://www.google.com/base/feeds/snippets/17245649833375023473,encore software 13911 - 3d home architect home & landscape deluxe suite version 9,b000pijt6i,3d home architect landscape design deluxe version 9
http://www.google.com/base/feeds/snippets/1695089910833084773,my first bible stories (jc),b0001gjc52,cross stitch design studio (jewel case)
http://www.google.com/base/feeds/snippets/17573573406959659844,encore software 10114 - adventure workshop 1st-3rd grade 7th ed sb cs by riverdeep,b000gkpds8,adventure workshop 4th-6th grade 7th ed sb cs by riverdeep
http://www.google.com/base/feeds/snippets/15438054179506762492,encore software 13891 - tlc millies math learning system 2008,b000ozhfsq,tlc dr. seuss reading learning system 2008
http://www.google.com/base/feeds/snippets/15481209573698256416,encore software 10931 - the print shop design suite proed sb cs by the print shop,b000he9psc,the print shop 22 pro publisher deluxe sb cs by the print shop
http://www.google.com/base/feeds/snippets/16082406061004654736,encore software 10612 - creating keepsakes scrapbook designer deluxe v.3 sb cs,b000pg7ha0,creating keepsakes scrapbook platinum v.3 sb cs by riverdeep
http://www.google.com/base/feeds/snippets/392494394952738157,the printshop pro publisher v22 deluxe dvd-rom,b000h22pg8,the print shop pro publisher 22 deluxe [dvd]
http://www.google.com/base/feeds/snippets/16408354394834145576,encore software 14111 - jeopardy! deluxe,b000ra5bmk,jeopardy! deluxe
http://www.google.com/base/feeds/snippets/975032998818002648,form workshop 1200,b0002qnd2y,form workshop 1200
http://www.google.com/base/feeds/snippets/10911853136488554482,imsi turbocad designer 11,b000bezsyi,imsi turbocad designer v.11
http://www.google.com/base/feeds/snippets/8272889934889959685,encore software 13921 - 3d home architect home design deluxe version 9,b000piht7e,3d home architect home design deluxe version 9
http://www.google.com/base/feeds/snippets/7402484848566215245,encore software 10561 - marine aquarium & goldfish screen saver by,b000pg8kwe,marine aquarium & goldfish screen saver by encore software
http://www.google.com/base/feeds/snippets/7349023854495904300,encore software 11273 - hasbro family collection 2006 sb cs by hasbro,b000he9pr8,hasbro family game collection 2006
http://www.google.com/base/feeds/snippets/10500380486679990055,the printshop v22 deluxe,b000h22rbg,the print shop 22 deluxe
http://www.google.com/base/feeds/snippets/6596219200360663289,encore software 10652 - web.com site builder & hosting suite sb by web.com,b000gkpe14,web.com site builder & hosting suite sb by web.com
http://www.google.com/base/feeds/snippets/10381298233088883938,xoom movie clone 3 gold,b000bl40dg,x-oom movie clone 3 gold
http://www.google.com/base/feeds/snippets/6320757184409585395,enfocus software pp7.0-ug-001 - pitstop pro 7.0 upgr - 6.x or higher,b000g0oom4,pitstop pro 7.0 upgr - 6.x or higher
http://www.google.com/base/feeds/snippets/6282886480523973402,encore software 10076 - mavis beacon typing 17 standardby broderbund,b000b6n2m6,mavis beacon teaches typing 17 standard
http://www.google.com/base/feeds/snippets/9616317575612495489,reader rabbit 1st grade,b00062jdka,reader rabbit learning system 1st grade
http://www.google.com/base/feeds/snippets/5515688203820371988,encore software 10118 - adventure workshop 4th-6th grade 7th ed sb cs by riverdeep,b000gkpds8,adventure workshop 4th-6th grade 7th ed sb cs by riverdeep
http://www.google.com/base/feeds/snippets/12904825904608701558,the big mix,b0002h6x34,reader rabbit preschool
