G_ID,G_TITLE,A_ID,A_TITLE
http://www.google.com/base/feeds/snippets/18251424810598585817,csdc liquid ledger personal finance - modeless software,b000ea9u2a,modeless liquid ledger personal finance software (mac)
http://www.google.com/base/feeds/snippets/17836395815164917371,topics entertainment instant immersion hawaiian audio,b000jx84va,instant immersion hawaiian audio
http://www.google.com/base/feeds/snippets/17520994730465780544,fogware publishing weekly reader ls mastering high school 2008,b000pienka,weekly reader mastering high school 2008
http://www.google.com/base/feeds/snippets/17521446718236049500,nero inc nero 8 ultra edition,b000v9yxj4,nero 8 ultra edition
http://www.google.com/base/feeds/snippets/17523098183862840727,sos aggregation company brain builder - core learning,b00029rapc,calculation skills v1 add & sub - basic - core learning
http://www.google.com/base/feeds/snippets/17525113929121763576,global marketing partners dvd player 3.0 - honest technology,b000ndo7n0,video patrol 5.0 by honest technology
http://www.google.com/base/feeds/snippets/18011756922272923721,aspyr media inc return to castle wolfenstein,b00005v55b,return to castle wolfenstein (mac)
http://www.google.com/base/feeds/snippets/17535862274044952617,masque publishing solitaire antics deluxe,b00065hjvc,solitaire antics deluxe
http://www.google.com/base/feeds/snippets/17504372812251027705,adobe systems inc flash remoting 1.0 (net&java 1)(1 user),b000ogsh3c,adobe creative suite cs3 production premium upsell
http://www.google.com/base/feeds/snippets/17506547254238780201,abacus aircraft collectors second edition,b000nkpf7k,aircraft collector's second edition
http://www.google.com/base/feeds/snippets/17477502346334387395,bobby walters academy award winners,b000lozewy,academy award winners
http://www.google.com/base/feeds/snippets/17479437813216357894,ca antivirus 2007,b000i7zabo,ca antivirus 2007
http://www.google.com/base/feeds/snippets/17501757616782483517,zone labs zonealarm pro,b000i3ec9y,zonealarm anti-spyware
http://www.google.com/base/feeds/snippets/17564132187132271868,tri synergy inc i love kittens,b00007e8bi,oxford world encyclopedia
http://www.google.com/base/feeds/snippets/17762641182538089473,encore inc hoyle solitaire,b000lu89uc,hoyle south beach solitaire
http://www.google.com/base/feeds/snippets/4921806606938865897,simple slide show,b0000yebre,simple slide show
http://www.google.com/base/feeds/snippets/5558998293398547766,print master platinum v17,b000egidpy,printmaster platinum v 17.0
http://www.google.com/base/feeds/snippets/9328281920275284345,school house rock! math rock,b00005birs,math 2
http://www.google.com/base/feeds/snippets/17546591632033422235,delorme mapping street atlas usa 2007 plus dvd xx,b000gpsz42,street atlas usa 2007 plus dvd
http://www.google.com/base/feeds/snippets/17544872940647061920,knowledge adventure inc. jumpstart world 2nd grade - mini box,b000i84dum,jumpstart world 2nd grade
http://www.google.com/base/feeds/snippets/17634318125830822917,findex.com inc quickverse bible study 2007 bible suite,b000jx5rz6,findex quickverse bible study 2007 bible-suite
http://www.google.com/base/feeds/snippets/17544063525352738794,global marketing partners video patrol 5.0 - honest technology,b000ndo7n0,video patrol 5.0 by honest technology
http://www.google.com/base/feeds/snippets/17456162504360585884,topics entertainment snap! kakuro,b000gcgqvy,snap! kakuro
http://www.google.com/base/feeds/snippets/12729065138733783657,american sign language,1931102953,instant immersion american sign language win/mac
http://www.google.com/base/feeds/snippets/17453864721509833307,findex.com inc sermon builder 4.0,b000fabege,quickverse sermon builder 4.0
http://www.google.com/base/feeds/snippets/17453432506391757198,encore inc adventure workshop 4th-6th grade 8th edition,b000ffsgho,adventure workshop 4th-6th grade 7th edition
http://www.google.com/base/feeds/snippets/17440820469218114890,abacus ultra sudoku/ultra kakuro,b000ezmxcy,ultra sudoku/ultra kakuro
http://www.google.com/base/feeds/snippets/17424435152951418977,individual software inc systemsuite 8 professional (us pos),b000v809mk,systemsuite 8 professional
http://www.google.com/base/feeds/snippets/17411408037622367354,avanquest usa llc pcdefense,b000hlt55i,pcdefense
http://www.google.com/base/feeds/snippets/17926987006913487270,knowledge adventure inc. jumpstart 4th-6th grade v 2.0 b43,b000v7vz2e,jumpstart 4th-6th grade v 2.0 b43
http://www.google.com/base/feeds/snippets/17641037628832356751,emedia music corp guitar pro v 5.1 (hybrid),b000gamysk,emedia guitarpro 5 win/mac
http://www.google.com/base/feeds/snippets/4635585281695496952,apple remote desktop 3 (10 managed systems),b000fdetx6,apple remote desktop 3 10 managed systems
http://www.google.com/base/feeds/snippets/17476622898499473532,encore inc monopoly 3,b000hhvb2w,monopoly 3
http://www.google.com/base/feeds/snippets/17472333646422001543,the coasters yamaha the very best of the coasters - smart pianosoft,b00005ljem,reader rabbit playtime for baby and toddler
http://www.google.com/base/feeds/snippets/17471276055285923188,re:launch piano wizard premier software & stickers & midi cable,b000b6jasg,piano wizard premier software & stickers & midi cable
http://www.google.com/base/feeds/snippets/17467141222535233488,intuit inc quicken home inventory manager,b000twz14o,intuit quicken home inventory manager - windows
http://www.google.com/base/feeds/snippets/18142071205016449884,avanquest usa llc spycatcher 2007,b000jx3mx0,spycatcher 2007for pc
http://www.google.com/base/feeds/snippets/17943324820292919047,global marketing partners antivirus v.10 - bit defender,b000j1h08k,bitdefender antivirus 10.0 [2 year subscription for 2 pcs]
http://www.google.com/base/feeds/snippets/11359745283620291559,madison media software aspvms8000 - acad vegas movie studio +dvd 8 platinum,b000skvy20,acad vegas movie studio +dvd 8 platinum
http://www.google.com/base/feeds/snippets/2062975649512805986,3d home architect home v.8by encore software,b000gr1ceu,3d home architect home v.8 by encore software
http://www.google.com/base/feeds/snippets/2084347887571442067,encore software 11290 - scrabble complete - win 98 me xp,b000hi1i2e,scrabble complete (jewel case)
http://www.google.com/base/feeds/snippets/2651646167662758246,encore software 11610 - scrabble with bonus clue - win 98 me 2000 xp,b000hhvb5e,scrabble with bonus clue
http://www.google.com/base/feeds/snippets/4108712449976038856,encore software 11750 - game of life - win 95 98,b000m6wlyk,game of life jc
http://www.google.com/base/feeds/snippets/17596883596074762243,adobe photoshop elements 4.0 photo-editing software for mac,b000ej9w0q,adobe photoshop elements 4.0 (mac)
http://www.google.com/base/feeds/snippets/381135748290856568,encore software 10567 - hoyle puzzle games 2007 - win 98 me 2000 xp,b000egidpe,hoyle puzzle & board games 2007
http://www.google.com/base/feeds/snippets/318535575684738487,encore software 33020 - jackpot tycoon - win 98 me 2000 xp,b0007sxgla,jackpot tycoon (jewel case)
http://www.google.com/base/feeds/snippets/9685850187894108398,encore software 11630 - monopoly tycoon - win 98 me 2000 xp,b000hhvbdq,monopoly tycoon
http://www.google.com/base/feeds/snippets/15030217405491356248,encore software 11140 - fate - win 2000 xp,b0002uhuii,encore the big box of art 410 000 ( 460001 )
http://www.google.com/base/feeds/snippets/2328950736697317790,encore software 10449 - high school advantage 2007 - win 98 me 2000 xp,b000fer1d0,high school advantage 2007
http://www.google.com/base/feeds/snippets/14007918865629410175,encore software 12380 - high school advantage 2008 - win 2000 xp vista,b000o3d9ce,high school advantage 2008
http://www.google.com/base/feeds/snippets/12942134175594025487,encore software 12370 - middle school advantage 2008 - win 2000 xp vista,b000o3bj3k,middle school advantage 2008
http://www.google.com/base/feeds/snippets/1861020527779170726,encore software 11580 - monopoly with bonus risk - win 98 me 2000 xp,b0002uhuii,encore the big box of art 410 000 ( 460001 )
http://www.google.com/base/feeds/snippets/1781031509566531842,encore software 10653 - professor fujis kakuro - win 98 me 2000 xp,b000hpf7p6,pc professor fuji's kakuro
http://www.google.com/base/feeds/snippets/1187936019689259805,encore software 10392 - network now! pro (win 98 me 2000 xp),b000cp4ja0,network now! pro by encore
http://www.google.com/base/feeds/snippets/1160856703276103950,encore software 13780 - westward - win 98 me 2000 xp vista,b0002uhuii,encore the big box of art 410 000 ( 460001 )
http://www.google.com/base/feeds/snippets/594191839879876004,encore software 14080 - q*bert - win 2000 xp vista,b00021lrw2,dk rainbow fish most beautiful fish in the ocean
http://www.google.com/base/feeds/snippets/9847776401829585115,encore software 11670 - who wants to be a millionaire? - win xp 2000,b000ieaplw,who wants to be a millionaire?
http://www.google.com/base/feeds/snippets/7702263644150091221,webroot software 65210 spy sweeper 3 pc,b000b6n2o4,webroot spy sweeper antispyware 5.x
http://www.google.com/base/feeds/snippets/13440353610523579374,encore software 11250 - brain food games: cranium collection 2006 - win 98 me 2000 xp,b000ie8u4g,brain food games: cranium collection 2006
http://www.google.com/base/feeds/snippets/17308332648335562662,encore software 11252 - brain food games: cranium collection 2006 - win 98 me 2000 xp,b000ie8u4g,brain food games: cranium collection 2006
http://www.google.com/base/feeds/snippets/6052848636732301170,encore software 25020 - marine aquarium 2.5 (hybrid) - win 95 98 me 2000 xp/mac 10.1 or higher,b0000959kx,marine aquarium 2.5 virtual undersea paradise win/mac
http://www.google.com/base/feeds/snippets/1503028931039652298,encore software 14130 - wheel of fortune deluxe - win 98 me 2000 xp vista,b000ra778g,wheel of fortune deluxe
http://www.google.com/base/feeds/snippets/10702491954940587385,encore software 10443 - elementary school advantage 2007 - win 98 me 2000 xp,b000fetuiy,elementary school advantage 2007
http://www.google.com/base/feeds/snippets/5609692463569230619,encore software 12360 - elementary advantage 2008 - win 2000 xp vista,b000o39u8q,elementary advantage 2008
http://www.google.com/base/feeds/snippets/6804198758936861643,encore software 10598 - registry mechanic - win 98 me 2000 xp,b000ap0h7g,before you know it - deluxe spanish edition for pc/mac
http://www.google.com/base/feeds/snippets/11742689310169054682,encore software 12390 - math advantage 2008 - win 2000 xp vista,b000o39tgo,math advantage 2008
http://www.google.com/base/feeds/snippets/9193874637345201048,microsoft uea-00033 - visual studio 2005 team edition for database professionals with msdn premium subscription renewal - complete product - software development - standard - 1 user - complete product - pc- free shipping,b000bt559q,microsoft visual studio team edition for software testers 2005 w/msdn premium renewal
http://www.google.com/base/feeds/snippets/4081985616275580076,apple software m9301z/b soundtrack v1.2,b0001bfdau,soundtrack 1.2
http://www.google.com/base/feeds/snippets/15528939772983751628,topics entertainment 80796 - topics math success 2007 deluxe for windows - educational software - pc,b00032heyk,topics presents: ancient civilizations (4 cd set)
http://www.google.com/base/feeds/snippets/16171315423038143989,punch software 26100 punch! master landscape and home design (small box),b00005aycg,punch! master landscape & home design
http://www.google.com/base/feeds/snippets/14941513108998426217,punch software 20100 punch! 5 in 1 home design,b000063v0z,punch! 5 in 1 home design
http://www.google.com/base/feeds/snippets/17661636837802252450,individual software prm-wn5 professor teaches windows xp,b0009qvgeo,professor teaches windows xp
http://www.google.com/base/feeds/snippets/1021042895134770712,encore software 10123 - aquarium 3-in-one limited edition (eurpac) - win 95 98 me 2000 xp,b0009yx9be,aquarium 3 in 1 collection - limited edition for win/mac
http://www.google.com/base/feeds/snippets/18207838499884290592,e-mu modern symphonic orchestra for emulator x and proteus x sounds for software,b000gzy7oo,e-mu em8669 modern symphonic orchestra
http://www.google.com/base/feeds/snippets/712876185653102576,individual software resume maker professional deluxe 12.0,b0009suw5q,resumemaker professional 12.0
http://www.google.com/base/feeds/snippets/4968803125750101769,punch software master landscape professional & home design v 10.0,b000enucs8,punch! master landscape professional & home design v 10.0
http://www.google.com/base/feeds/snippets/12243674671451624208,panda software panda internet security 2007,b000in4uak,panda internet security 2007 3-user
http://www.google.com/base/feeds/snippets/12849123232978824729,individual software professor teaches excel & word,b0009dt87e,professor teaches excel & word
http://www.google.com/base/feeds/snippets/17491282253363994324,individual software professor teaches windows xp,b0009qvgeo,professor teaches windows xp
http://www.google.com/base/feeds/snippets/6628446350064818078,encore software 14060 - terror strike - win 2000 xp,b000ra3l3g,terror strike
http://www.google.com/base/feeds/snippets/18429469423592646579,cisco nac appliance server (clean access server) software (250 users),b000a6jrwq,cisco ios enterprise services - complete package ( cd28-esk9= )
http://www.google.com/base/feeds/snippets/5098650180744423847,adobe premiere pro cs3 software with encore cs3 and onlocation cs3 (windows only) full version for macintosh,b000ndibhi,adobe creative suite cs3 web standard upsell [mac]
http://www.google.com/base/feeds/snippets/8589080476501847235,adobe premiere pro cs3 software with encore cs3 and onlocation cs3 (windows only) full version for windows,b000ofnri8,adobe creative suite cs3 production premium upgrade
http://www.google.com/base/feeds/snippets/9584209186514584056,onone software smartscale software,b000e3fn4g,onone software pxl smartscale ( windows and macintosh )
http://www.google.com/base/feeds/snippets/8261805484012687318,onone software genuine fractals print pro software,b000eqieik,genuine fractals genuine fractals print pro 1u
http://www.google.com/base/feeds/snippets/17330505621209587005,onone software intellihance pro 4 for mac/pc,b000e3e2km,onone software intellihance pro 4.1
http://www.google.com/base/feeds/snippets/8894150903607310427,microsoft digital image suite plus full version of photo editing software for windows.,b000ayktam,microsoft digital image suite 2006 plus pinnacle studio 10.0
http://www.google.com/base/feeds/snippets/9660795325358759539,topics entertainment 40206 - instant immersion german lab (software/audiobook/workbook) - win 98 me 2000 xp/mac os 9 or x,b000bgpqr0,instant immersion german deluxe 2.0
http://www.google.com/base/feeds/snippets/4776201646741876078,apple software m8789z/a webobjects 5.2,b000088ner,webobjects 5.2
http://www.google.com/base/feeds/snippets/16750826951044664483,phantom efx reel deal slots v 2.0,b00099e4ya,reel deal slots 2.0 for pc
http://www.google.com/base/feeds/snippets/16750822567909349008,topics entertainment in their own words - wwii (audiobook),b000jx29wa,instant immersion japanese (audio book)
http://www.google.com/base/feeds/snippets/16755727468265308879,tri synergy inc wisdom of the bible - holy land edition,b0009nr9mu,wisdom of the bible - holy land edition
http://www.google.com/base/feeds/snippets/16739935323659993586,tri synergy inc test & improve your memory - scientific brain training,b0002ip4lu,test and improve your memory (dvd box)
http://www.google.com/base/feeds/snippets/16744224390148606478,masque publishing best of slots ii,b00024wjrq,best of slots 2 (jewel case)
http://www.google.com/base/feeds/snippets/16721626632033099240,dvo enterprises inc. cookn low fat,b0009jhv5e,cook'n low fat
http://www.google.com/base/feeds/snippets/16720347622986234211,topics entertainment i spy fantasy w/ i spy bk & mini cd,b000a40w4a,i spy fantasy v.2 with i spy book & mini cd
http://www.google.com/base/feeds/snippets/16700933768709687512,egames. inc casual games pack,b000nkklwe,casual games pack
http://www.google.com/base/feeds/snippets/16702887737767240197,iris inc irispen express translator,b000f7gysa,irispen express translator
http://www.google.com/base/feeds/snippets/17022948292176830818,individual software typing instructor for kids,b0009dt87e,professor teaches excel & word
http://www.google.com/base/feeds/snippets/16433681558697255842,individual software professor teaches microsoft office 2007,b0009qvgeo,professor teaches windows xp
http://www.google.com/base/feeds/snippets/16690738478999740250,topics entertainment instant immersion spanish audio deluxe,b000ivjv10,instant immersion ingles audio deluxe
http://www.google.com/base/feeds/snippets/18226659788744119005,individual software anytime organizer deluxe 10,b000edjjhs,individual small business advantage deluxe 2006
http://www.google.com/base/feeds/snippets/16694806128312036500,sos aggregation company dance praise - digital praise,b000lu8a10,listen for ipod - magnetic time
http://www.google.com/base/feeds/snippets/16698946140878275557,school zone interactive time money & fractions 1-2 on track software,b000099107,time money & fractions grades 1-2
http://www.google.com/base/feeds/snippets/16673725682059181917,topics entertainment instant immersion ingles audio deluxe,b000ivjv10,instant immersion ingles audio deluxe
http://www.google.com/base/feeds/snippets/16676630267570211401,topics entertainment talk now! afrikaans - beginners,b000lptgc2,phonics success essentials: grades 7-9
http://www.google.com/base/feeds/snippets/16685945982481680279,sos aggregation company iaudioize - magnetic time,b000lu8a10,listen for ipod - magnetic time
http://www.google.com/base/feeds/snippets/13017887935047670097,individual software professor teaches excel and word,b0009dt87e,professor teaches excel & word
http://www.google.com/base/feeds/snippets/16687635820409313347,sony media software vegas movie studio + dvd 8 platinum edition,b000rlqnr6,sony vegas movie studio + dvd 8 platinum edition
http://www.google.com/base/feeds/snippets/16668702350993735780,kutoka interactive inc didi & ditto (kindergarten),b0002fgfiy,didi & ditto: kindergarten win/mac
http://www.google.com/base/feeds/snippets/16738828984601610049,bling software limited safekeeper plus,b000jx1on0,safekeeper plus
http://www.google.com/base/feeds/snippets/16647647854444612501,topics entertainment instant immersion italian 2.0,b0008ews6w,instant immersion japanese 2.0
http://www.google.com/base/feeds/snippets/16874485945364761422,aspyr media inc travelogue 360: paris,b000trgqqg,travelogue 360: paris
http://www.google.com/base/feeds/snippets/16872612252422367466,imsi design llc turbocad mac 3d,b000b5srju,turbocad mac 3d for mac
http://www.google.com/base/feeds/snippets/8642411099663690660,individual software professor teaches windows vista,b0009qvgeo,professor teaches windows xp
http://www.google.com/base/feeds/snippets/16862951998092117648,sage (ptree) premium accounting accountants edition 2007,b000g80lku,peachtree by sage premium accounting 2007 - accountants' edition
http://www.google.com/base/feeds/snippets/16846135635145492175,migo software digital file shredder 2005,b000aqvrry,stompsoft digital file shredder pro
http://www.google.com/base/feeds/snippets/16827217446944316033,sony online entertainment gods & heroes rome rising,b000jlj0cy,gods & heroes: rome rising
http://www.google.com/base/feeds/snippets/16819471998102486336,synet electronics inc. synet pc sharing kit(w/17ft usb ext.cable),b00099xf0e,synet pc sharing kit(w/17ft usb ext.cable)
http://www.google.com/base/feeds/snippets/16816523477506304009,school zone interactive math 2 on track software,b000099107,time money & fractions grades 1-2
http://www.google.com/base/feeds/snippets/16814254064816255791,prosoft engineering data rescue universal license,b0000c120d,microsoft publisher with digital imaging 2003 [old version]
http://www.google.com/base/feeds/snippets/16790631679419428442,individual software inc typing instructor deluxe j/c,b0009dxjuq,typing instructor deluxe (jewel case)
http://www.google.com/base/feeds/snippets/16793437722628106463,vivendi-universal games inc freestyle street basketball,b000nif4im,freestyle street basketball
http://www.google.com/base/feeds/snippets/16778737466501327415,emedia music corp my guitar,b000jj4fbw,emedia essential bass guitar
http://www.google.com/base/feeds/snippets/16766361081929880488,topics entertainment classics the: the piano,b0007yepyg,instant landscaping 3.0 [lb]
http://www.google.com/base/feeds/snippets/16769449274864717899,sega of america inc rome total war gold edition,b000e2d3lc,rome total war gold edition
http://www.google.com/base/feeds/snippets/16630396354315555450,fogware publishing middle school life science - classification & ecology,b000fzxipo,classification & ecology (win/mac) (jewel case)
http://www.google.com/base/feeds/snippets/16622880533554607802,avanquest usa llc britannica deluxe,b000hedyio,britannica deluxe
http://www.google.com/base/feeds/snippets/18364436159487312703,aspyr leave the lights on-bundle,b0000vmimw,leave the lights on (mac)
http://www.google.com/base/feeds/snippets/18347005743602331538,microspot macdraft professional edition,b0007wv3ei,microspot macdraft professional (mac)
http://www.google.com/base/feeds/snippets/18282499725938188855,sims 2 pets for mac,b000jgqt28,sims 2 pets expansion pack
http://www.google.com/base/feeds/snippets/18341451742874553099,adobe cs3 design premium upgrade,b000ub66ha,adobe cs3 design premium macosx dvd
http://www.google.com/base/feeds/snippets/17244314871392617212,laughingbird the logo creator,b0009ftmj6,the logo creator (mac)
http://www.google.com/base/feeds/snippets/17298610841039937504,apple .mac 4.0 1yr new or renewal internet service,b0007lw230,apple .mac 4.0 online service
http://www.google.com/base/feeds/snippets/17215854618313178923,microspot x-rip large format print driver for os x,b00094oszk,microspot x-rip (mac)
http://www.google.com/base/feeds/snippets/17511510969143463932,adobe contribute cs3 upgrade,b000ndicze,adobe contribute cs3 [mac]
http://www.google.com/base/feeds/snippets/17512159947329144136,valusoft tune transfer for ipod,b000922deu,valuesoft tune transfer for ipod - software for windows xp
http://www.google.com/base/feeds/snippets/17555720475076621347,git amazing spider-man the complete collection dvd-rom,b000hkim7q,amazing spider-man complete comic book collection win/mac
http://www.google.com/base/feeds/snippets/17570801106897429429,intuit quicken 2007 macintosh,b000h16pag,quicken 2007 for mac
http://www.google.com/base/feeds/snippets/17408691567696039043,legion arena,b000aoz7jk,net ad creator
http://www.google.com/base/feeds/snippets/17409309332075689843,adobe photoshop cs3 extended for mac upgrade,b000ndibqy,adobe photoshop cs3 extended upgrade [mac]
http://www.google.com/base/feeds/snippets/17796380407605098808,adobe lightroom version 1 for windows and mac academic,b000e8jlas,adobe audition 2.0 upgrade
http://www.google.com/base/feeds/snippets/17784299186975876292,microsoft office 2004 standard,b0001wn0m2,microsoft office 2004 standard (mac)
http://www.google.com/base/feeds/snippets/18004448735840625942,allume stuffit deluxe 11 os x 10.4 or higher,b000j5lgg8,stuffit deluxe 11
http://www.google.com/base/feeds/snippets/17823721749459533075,nova print explosion deluxe 3.0,b000exu9ay,print explosion deluxe 3.0 (mac)
http://www.google.com/base/feeds/snippets/17666397403215916975,micromat techtool protege utility with 1gb firewire flash drive,b000ldqs9s,micromat techtool protege with firewire device
http://www.google.com/base/feeds/snippets/17708460496974727302,chronos stickybrain 3.0,b00094ot4a,chronos stickybrain 3.0 (mac)
http://www.google.com/base/feeds/snippets/18227817484834707150,allume spring cleaning 9.0,b000bljed2,allume aquazone seven seas deluxe
http://www.google.com/base/feeds/snippets/18190371164810858934,allume smith micro faxstf pro,b000bljed2,allume aquazone seven seas deluxe
http://www.google.com/base/feeds/snippets/18274317756231697680,adobe cs3 production premium academic,b000ub66ha,adobe cs3 design premium macosx dvd
http://www.google.com/base/feeds/snippets/18106742966338682113,freeverse burning monkey solitaire 3d,b000p9eqva,burning monkey solitaire 4.0
http://www.google.com/base/feeds/snippets/18053348848713858697,allume internet cleanup 4.0,b000a2aknu,internet cleanup 3.0
http://www.google.com/base/feeds/snippets/16351355486478883410,graphicsim istopmotion,b000iek7kg,istopmotion
http://www.google.com/base/feeds/snippets/16388256207576026986,microsoft office 2004 std upgrade,b0001wn0ky,microsoft office 2004 standard upgrade (mac)
http://www.google.com/base/feeds/snippets/16319944090637292990,prosoft engineering drive genius 1.5,b0009xndso,prosoft tunetech for ipod (mac)
http://www.google.com/base/feeds/snippets/16406760233183606059,adobe cs3 design standard upsell,b000ndibnc,adobe creative suite cs3 design standard upsell [mac]
http://www.google.com/base/feeds/snippets/16445577344159065644,graphic sim x-plane 8,b0006i7glw,x-plane v8 (mac)
http://www.google.com/base/feeds/snippets/16699804671191247885,freeverse burning monkey mahjong 3d,b0007ly3zu,burning monkey mahjongg (mac)
http://www.google.com/base/feeds/snippets/16579315096492817894,adobe cs3 production premium,b000e8jlbw,adobe production studio premium
http://www.google.com/base/feeds/snippets/16714036815187031033,intuit quickbooks pro 2007 for mac,b000hc0lw8,quickbooks pro 2007 for mac (mac)
http://www.google.com/base/feeds/snippets/16934204320953872944,adobe indesign cs3 for mac upgrade from pagemaker,b000ndic40,adobe indesign cs3 upgrade from pagemaker
