G_ID,G_TITLE,A_ID,A_TITLE
http://www.google.com/base/feeds/snippets/11125907881740407428,learning quickbooks 2007,b000hbxjxc,learning quickbooks 2007
http://www.google.com/base/feeds/snippets/11343515411965421256,qb pos 6.0 basic software,b000hbysc8,quickbooks point-of-sale basic 6.0
http://www.google.com/base/feeds/snippets/12049235575237146821,math missions: the amazing arcade adventure (grades 3-5),b00009vrfk,math missions: the amazing arcade adventure grades 3-5
http://www.google.com/base/feeds/snippets/12244614697089679523,production prem cs3 mac upgrad,b000ofnri8,adobe creative suite cs3 production premium upgrade
http://www.google.com/base/feeds/snippets/12311932123270766595,video studio 11 plus,b000qeitty,videostudio 11 plus
http://www.google.com/base/feeds/snippets/12835181529749808477,qb pos 6.0 pro multi store sw,b000i2qubi,quickbooks pos: pro multistore 6.0
http://www.google.com/base/feeds/snippets/12949835105262366018,qb credit card kit 3.0,b000hc0m36,quickbooks credit card processing kit 3.0
http://www.google.com/base/feeds/snippets/12991998923940483779,vegas movie studiodvd+8 plat,b000ro5o7s,vegas movie studiodvd+8 plat
http://www.google.com/base/feeds/snippets/13394537834910060641,qb pos 6.0 pro solution hw/sw,b000i2qubi,quickbooks pos: pro multistore 6.0
http://www.google.com/base/feeds/snippets/13665841494141374823,ares rising,b000etyt5o,ares rising
http://www.google.com/base/feeds/snippets/13693694360546677062,10517940 symantec client security with groupware protection business pack - ( v. 3.1 ) -,b000exu6cu,symantec client security 3.1 with groupware protection business pack 50 user
http://www.google.com/base/feeds/snippets/5781318040297863663,ipswitch wd-1000-0900 ws_ftp pro 9 sdk w/ ws_ftp pro,b0006513tg,ipswitch inc ws ftp pro 9 sdk w/ ws ftp pro ( wd-1000-0900 )
http://www.google.com/base/feeds/snippets/9949258255997064102,money prem 2007 cd minibox,b000jgf410,money premium 2007 win32 eng na mini box us only cd
http://www.google.com/base/feeds/snippets/12905177887993533095,dora the explorer: dora world adventures pc cd-rom,b000hcl5sm,dora the explorer: dora's world adventures
http://www.google.com/base/feeds/snippets/10299611596430222322,adobe photoshop elements 4.0 mac,b000ej9w0q,adobe photoshop elements 4.0 (mac)
http://www.google.com/base/feeds/snippets/9985030341591149569,sims 2 season expansion pack,b000pu7422,sims 2 seasons expansion pack
http://www.google.com/base/feeds/snippets/9897777989987457856,roxio popcorn 2 video conversion software,b000ehs6ic,roxio popcorn 2 (mac)
http://www.google.com/base/feeds/snippets/18225778049143407208,avanquest usa llc partition commander 10,b000saufbg,partition commander 10
http://www.google.com/base/feeds/snippets/9761533219806554318,adobe indesign cs3 for mac upgrade,b000ndibe6,adobe indesign cs3 upgrade [mac]
http://www.google.com/base/feeds/snippets/10445277524546945239,macspeech ilisten software,b0000c6eol,ilisten (mac)
http://www.google.com/base/feeds/snippets/18234349657423202538,destineer publishing coporation starship troopers/first to fight bundle,b000jx1kgq,starship troopers/first to fight bundle
http://www.google.com/base/feeds/snippets/18240281005302874979,global marketing partners art text - belight software,b000ndo7n0,video patrol 5.0 by honest technology
http://www.google.com/base/feeds/snippets/18118065911754783035,emedia finale allegro,b000nlwxii,emedia guitar basics
http://www.google.com/base/feeds/snippets/18264562147667335719,phantom efx reel deal slots mystic forest,b000h25yr0,reel deal slots mystic forest
http://www.google.com/base/feeds/snippets/18259447335875519213,orion/imaginova starry night galaxy explorer,b0009yegpc,starry night galaxy explorer (pc & mac)
http://www.google.com/base/feeds/snippets/18264347410665748173,global software publ na sudoku,b000tilkpc,global software smart steps 1st grade ( windows macintosh )
http://www.google.com/base/feeds/snippets/18295506345742178609,encore inc elementary advantage 2008,b000o3ek2m,elementary advantage 2008
http://www.google.com/base/feeds/snippets/10555450463385817719,jungle software gorilla pro 4.0 film production,b000mgo1r0,gorilla 4 pro
http://www.google.com/base/feeds/snippets/18275035621919457369,dreamcatcher interactive obscure,b0008g2bvm,obscure
http://www.google.com/base/feeds/snippets/18213081663134894535,adobe acrobat v8.0 professional for mac upsell from std-pro,b000i8od4i,acrobat professional 8 mac upsell standard-professional
http://www.google.com/base/feeds/snippets/18286585073343765950,tri synergy inc oxford world encyclopedia,b00007e8bi,oxford world encyclopedia
http://www.google.com/base/feeds/snippets/18163685181387991761,digital leisure inc dance 6 (e-jay),b000bu7u48,dance praise with dance pad (win/mac)
http://www.google.com/base/feeds/snippets/18159360858957097495,stamps.com your desktop post office,b000jh7c6y,your desktop post office for pc
http://www.google.com/base/feeds/snippets/9043771553757075875,adobe soundbooth cs3,b000o27rgy,adobe soundbooth cs3
http://www.google.com/base/feeds/snippets/18190434268931466210,encore inc registry mechanic,b000itvtqm,calendar creator platinum sb cs by riverdeep
http://www.google.com/base/feeds/snippets/9426718267663314434,adobe illustrator cs3 upgrade for mac,b000ndib96,adobe illustrator cs3 upgrade [mac]
http://www.google.com/base/feeds/snippets/9250111493808447085,jungle software gorilla student 4.0 film production,b000mgo5bw,gorilla 4 student
http://www.google.com/base/feeds/snippets/18171290245464117932,topics entertainment instant play guitar deluxe v2.0,b000q1pyv8,instant play guitar deluxe v2.
http://www.google.com/base/feeds/snippets/9342175169264415955,iplaymusic beginner guitar lessons mac,b000g3mer8,iplaymusic beginner guitar lessons for the mac and ipod
http://www.google.com/base/feeds/snippets/9484979283744840884,adobe cs3 web premium upsell,b000ndibws,adobe creative suite cs3 web premium upsell [mac]
http://www.google.com/base/feeds/snippets/18197889323079921411,onone software qx-tools pro 7 - upgrade,b000e3e2km,onone software intellihance pro 4.1
http://www.google.com/base/feeds/snippets/18195210518723634061,encore inc adventure workshop preschool-1st grade 8th edition,b000o39u3q,adventure workshop preschool-1st grade 8th edition
http://www.google.com/base/feeds/snippets/9757350103424139605,micromat podlock ipod utility software,b0009afff6,micromat podlock (mac)
http://www.google.com/base/feeds/snippets/9526578983773698753,adobe premiere pro cs3,b000ofnrhy,adobe premiere pro cs3
http://www.google.com/base/feeds/snippets/18218026817519050250,individual software inc bookkeeper 2008 (us pos),b000v7v2uo,bookkeeper 2008
http://www.google.com/base/feeds/snippets/9647142668602200141,adobe cs3 flash professional upgrade,b000ndicqi,adobe flash pro cs3 upgrade [mac]
http://www.google.com/base/feeds/snippets/18205002084046387310,strategy first inc. culpa innata,b000hus51e,great invasions
http://www.google.com/base/feeds/snippets/11063455580387217522,netopia timbuktu pro for mac single license,b0009rkkmc,timbuktu remote control softwre 10 licenses for windows
http://www.google.com/base/feeds/snippets/18066386301399841327,topics entertainment instant immersion spanish advanced audio,b000j4k804,instant immersion spanish (audio book)
http://www.google.com/base/feeds/snippets/11095209417717978147,vivendi blizzard world of warcraft,b000h5ex7e,world of warcraft pc
http://www.google.com/base/feeds/snippets/18073883319223617218,sage (ptree) premium accounting for manufacturing 2007 multi-user,b000g7wses,peachtree by sage premium accounting for manufacturing 2007 multi user (up to 5 users)
http://www.google.com/base/feeds/snippets/18089023914130738551,avanquest usa llc system care professional,b000lu89yi,system care professional
http://www.google.com/base/feeds/snippets/18097036016943613075,punch software pro home design suite,b000067fk7,punch! professional home design suite
http://www.google.com/base/feeds/snippets/18105761375553744131,school zone interactive vocabulary puzzles 1 on track software,b000099108,vocabulary puzzles grade 1
http://www.google.com/base/feeds/snippets/18107239556630917796,steinberg software cubase se 3.0 - educational edition,b000rgxto6,cubase se3 educational edition
http://www.google.com/base/feeds/snippets/18113699401844993243,sony media software photo go (with $5 mir),b000ag5sb0,sony super duper music looper
http://www.google.com/base/feeds/snippets/18135578158357182921,topics entertainment snap! hair styler studio,b000gcd73y,snap! hair styler studio
http://www.google.com/base/feeds/snippets/18141440313618559567,freeverse software toysight gold,b0006aaoiw,burning monkey solitaire 2005 edition
http://www.google.com/base/feeds/snippets/10713659865788525116,symantec norton anti-virus v.10 mac,b0009i5px0,norton antivirus mac 10.0 (mac)
http://www.google.com/base/feeds/snippets/10719377059258538369,adobe premiere pro cs3 academic,b000o24l3q,adobe premiere pro cs3 upgrade
http://www.google.com/base/feeds/snippets/17982318849719467269,viva media llc riding academy: jump & ride,b000b676fa,riding academy: jump & ride
http://www.google.com/base/feeds/snippets/18000939542340526750,encore inc printmaster gold v 17.0,b000egidpo,printmaster gold v 17.0
http://www.google.com/base/feeds/snippets/10827782844634609439,feral interactive ford racing 2 for os x,b0002iwyke,ford racing 2 (mac)
http://www.google.com/base/feeds/snippets/10849068506859926430,apple ilife '06,b0007lw23a,apple iwork '06 (mac dvd)
http://www.google.com/base/feeds/snippets/18003213870869015246,sega of america inc sonic mega collection,b000ml8d5q,sonic mega collection plus
http://www.google.com/base/feeds/snippets/10851688356333529622,jungle software gorilla standard 4.0 film production,b000mgvnks,gorilla 4 standard
http://www.google.com/base/feeds/snippets/10902155796053790562,checkmark multiledger 6.0,b000068u3h,checkmark multiledger
http://www.google.com/base/feeds/snippets/18014351345232205148,simply magazine finance your business,b000ccvp0a,simply put software data eliminator
http://www.google.com/base/feeds/snippets/10939909441298262260,apple ilife '06 family pack,b0007lw22q,apple ilife '06 family pack (mac dvd) [older version]
http://www.google.com/base/feeds/snippets/18011289804558195936,dreamcatcher interactive wanted - wild willy west,b00062vos4,wanted: a wild western adventure
http://www.google.com/base/feeds/snippets/18029245320668853953,microvision development webexpress,b000q6zk3a,microsoft student with encarta premium 2008 dvd
http://www.google.com/base/feeds/snippets/10956401022937572078,fogware hyb art dvd,b000bs2vzs,art (dvd) (pc & mac)
http://www.google.com/base/feeds/snippets/18046511712294457433,emedia music corp emedia guitar basics,b000nlwxii,emedia guitar basics
http://www.google.com/base/feeds/snippets/18054567164113625813,abacus usa/world extreme landscapes bundle,b000pijszk,usa/world extreme landscapes bundle
http://www.google.com/base/feeds/snippets/7898902077337932386,corel painter x,b000mtebtu,corel painter x win/mac
http://www.google.com/base/feeds/snippets/17943553623332924825,csdc more brain games - on hand software,b000io79mu,more brain games
http://www.google.com/base/feeds/snippets/7882287499485291732,microsoft windows vista ultimate retail no open box returns,b000hctyte,microsoft windows vista ultimate full version [dvd]
http://www.google.com/base/feeds/snippets/17943895287006074116,encore inc registry mechanic 6.0,b000ffcdim,registry mechanic by encore software
http://www.google.com/base/feeds/snippets/17936351408567096042,csdc macdrive 7 for windows - mediafour corp.,b000kmaa8a,visual thesaurus the - thinkmap inc.
http://www.google.com/base/feeds/snippets/7795796130761039507,adobe cs3 design standard academic,b000ub6avc,adobe cs3 design standard macosx dvd
http://www.google.com/base/feeds/snippets/17939626833908573527,encore inc math advantage 2008,b000o39tgo,math advantage 2008
http://www.google.com/base/feeds/snippets/17922830512683848229,csdc route 66 route canada (french),b000dzfdbi,route 66 route canada (french)
http://www.google.com/base/feeds/snippets/7744548491761569898,sims 2 open for business,b000gw55es,the sims 2: open for business expansion pack
http://www.google.com/base/feeds/snippets/7744305702477366904,aspyr lego star wars,b0007znn48,lego star wars (dvd) (mac)
http://www.google.com/base/feeds/snippets/17919905528679711200,grisoft avg anti-virus & anti-spyware,b000s5x3q0,grisoft avg anti-virus & anti-spyware - 2 year subscription
http://www.google.com/base/feeds/snippets/8056776198231015744,phase one capture one le,b000fer1cq,phase one capture one le
http://www.google.com/base/feeds/snippets/17967900865986277130,encore inc family tree maker version 16 collectors edition,b000kbszns,family tree maker version 16 collectors edition
http://www.google.com/base/feeds/snippets/8050920942672245174,aspyr sims 2 university expansion pack,b000bi641a,sims 2 university expansion pack
http://www.google.com/base/feeds/snippets/8042583218932085904,adobe cs3 web standard upsell,b000ndic9a,adobe creative suite cs3 web standard upsell
http://www.google.com/base/feeds/snippets/17967569973770560353,school zone interactive flash action addition & subtraction,b00007bguc,school zone flash action -- addition/subtraction (windows/macintosh)
http://www.google.com/base/feeds/snippets/7972469902462196789,adobe cs3 after effects upgrade,b000o26lo8,adobe after effects cs3 upgrade
http://www.google.com/base/feeds/snippets/17956725325082284641,nova development corp art explosion 600000 images,b00001qgvr,art explosion 600 000 images
http://www.google.com/base/feeds/snippets/7937630813831495909,apple aperture v 1.5 photo editing,b000j1cit6,apple aperture 1.5
http://www.google.com/base/feeds/snippets/17962667015870936885,topics entertainment instant immersion german 2.0,b0008ews6w,instant immersion japanese 2.0
http://www.google.com/base/feeds/snippets/7928058720709111960,adobe photoshop cs3 extended for mac,b000ndibq4,adobe photoshop cs3 extended [mac]
http://www.google.com/base/feeds/snippets/17956249157120493393,intuit inc quickbooks premier edition 2007 5 user,b000hbxjve,quickbooks premier edition 2007 - 5 user multi-pack
http://www.google.com/base/feeds/snippets/7415156197197389350,apple iwork '06 family pack,b0008glgea,apple iwork '06 family pack (mac dvd) [older version]
http://www.google.com/base/feeds/snippets/17878975434909198145,susteen inc datapilot cell phone data transfer suite universal,b0001ghg64,datapilot cell phone data transfer suite universal
http://www.google.com/base/feeds/snippets/17872821788401002421,warner home video - games hospital tycoon,b000r1cs5w,hospital tycoon for pc
http://www.google.com/base/feeds/snippets/17871729840721789776,ca internet security suite plus 2008 w/$10000 warranty,b000he35ss,mcafee internet security suite 2007 - 3 users
http://www.google.com/base/feeds/snippets/17846711186532338786,simply put software llc mozy 3.0,b000ccvp0a,simply put software data eliminator
http://www.google.com/base/feeds/snippets/7739419455751524618,microsoft windows xp pro sp2 retail,b00022pti4,microsoft windows xp professional full version with sp2
http://www.google.com/base/feeds/snippets/17911312393691300802,roxio inc stopzilla 4.0,b000cfx744,stopzilla 4.0
http://www.google.com/base/feeds/snippets/7742313617688572944,chronos soho labels and envelopes,b00030iej6,soho labels & envelopes - chronos l.c.
http://www.google.com/base/feeds/snippets/17907379108807127194,delorme mapping topo usa 6.0 west region,b000ezp0n8,delorme topo usa mapping software 6.0 west region
http://www.google.com/base/feeds/snippets/7704167897291051109,broderbund mavis beacon teaches typing deluxe17,b0001gu7di,mavis beacon teaches typing deluxe 16
http://www.google.com/base/feeds/snippets/17896835956549874370,encore inc family tree maker v 16 essentials,b000h1xy3m,family tree maker version 16 essentials
http://www.google.com/base/feeds/snippets/7587316869277129977,phase one capture one pro,b000fer1cq,phase one capture one le
http://www.google.com/base/feeds/snippets/17886724437749928713,masque publishing sportsmans double play with american billiards,b000iflerk,sportsman's double play
http://www.google.com/base/feeds/snippets/8761785470712681109,microsoft windows xp home edition sp2 retail box,b00022ptru,microsoft windows xp home edition full version with sp2
http://www.google.com/base/feeds/snippets/18180725296745787083,emedia music corp emedia intermediate guitar method,b000162zp6,emedia intermediate guitar method os x
http://www.google.com/base/feeds/snippets/8829327324895223617,entertainment partners ep budgeting for film,b0001nm7zm,entertainment partners budgeting (mac)
http://www.google.com/base/feeds/snippets/18312853825749428303,nova development corp ideasoft photo clip art 10000,b0001av65w,ideasoft photo clip art 10 000
http://www.google.com/base/feeds/snippets/17832927937923546408,csdc pop-up stopper professional - panicware,b0000als2s,pop-up stopper professional
http://www.google.com/base/feeds/snippets/17834804262117799503,steinberg software halion symphonic orchestra - educational edition,b000k6b2l0,steinberg halion symphonic orchestra virtual instrument (academic version)
http://www.google.com/base/feeds/snippets/8648200549603855201,apple final cut studio 2 upgrade from final cut studio,b000pgq8sm,apple final cut studio 2 upgrade from final cut studio (mac)
http://www.google.com/base/feeds/snippets/8968352871606641625,netopia timbuktu pro for mac and windows 2 pack,b0009n4gx0,timbuktu remote control softwre 2 licenses for windows & mac
http://www.google.com/base/feeds/snippets/9000601847258285543,super collapse! 3,b000bi8m2e,super collapse 3
http://www.google.com/base/feeds/snippets/8835348783533497285,entertainment partners ep budgeting for film academic,b0001nm7zm,entertainment partners budgeting (mac)
http://www.google.com/base/feeds/snippets/18240279639195527181,encore inc printshop business card maker,b000b56boi,the print shop 21 standard by broderbund
http://www.google.com/base/feeds/snippets/8317633865991250636,apple shake 4.1 mac os x,b000bx5ggy,apple shake 4.1 visual effects (mac)
http://www.google.com/base/feeds/snippets/17787032142812456248,intego inc internet security barrier x4 antispam edition,b000ivjsb8,internet security barrier x4 antispam edition
http://www.google.com/base/feeds/snippets/17771223071817478541,mcafee inc total protection 2007 3-user,b000he39mk,mcafee total protection 2007 - 3 users
http://www.google.com/base/feeds/snippets/17758143132560820340,topics entertainment instant immersion german audio,b000ivl050,instant immersion german audio
http://www.google.com/base/feeds/snippets/8148630564555070134,adobe cs3 after effects academic,b000o26lo8,adobe after effects cs3 upgrade
http://www.google.com/base/feeds/snippets/17760107129811199554,iris inc readiris pro 11 corporate edition,b000j6dues,readiris pro 11 corporate edition
http://www.google.com/base/feeds/snippets/17820910954802049244,sibelius sibelius photoscore professional 4,b000bdiqpc,neuratron photoscore professional 4
http://www.google.com/base/feeds/snippets/17817863026849640364,encore inc 3d home architect home design deluxe version 9,b000piht7e,3d home architect home design deluxe version 9
http://www.google.com/base/feeds/snippets/17828266310377038415,adobe systems inc adobe acrobat 8.0 professional upsell (std-pro),b000i8od4i,acrobat professional 8 mac upsell standard-professional
http://www.google.com/base/feeds/snippets/8498979351589060419,apple garageband jam pack: world music,b000bwzxk4,apple garageband jam pack: world music
http://www.google.com/base/feeds/snippets/17802084899902028186,abacus vuvideo anywhere for your ipod,b000csralc,vuvideo anywhere for your ipod
http://www.google.com/base/feeds/snippets/17790799708366999123,findex.com inc quickverse mac bible study 2007 white box,b000in8nhq,quickverse mac bible study 2007 white box
http://www.google.com/base/feeds/snippets/13621555970489144689,aspyr star wars battlefront mac os x,b0006b64v2,star wars battlefront (mac)
http://www.google.com/base/feeds/snippets/8395248988761650431,cosmic blobs: the lab rat edition by solidworks,b0007vubx8,cosmic blobs: lab rat edition (win & mac)
http://www.google.com/base/feeds/snippets/5935343405881149008,alsoft diskwarrior for intel,b000k5uxys,alsoft diskwarrior: mac univeral binary
http://www.google.com/base/feeds/snippets/5767845185221029524,adobe cs3 web premium,b000ndibvo,adobe creative suite cs3 web premium [mac]
http://www.google.com/base/feeds/snippets/5673733196767057398,adobe dreamweaver cs3,b000ndid26,adobe dreamweaver cs3 [mac]
http://www.google.com/base/feeds/snippets/5631550280326312479,apple final cut studio 2 upgrade from final cut pro,b000pgs3cq,apple final cut studio 2 upgrade from final cut pro (mac)
http://www.google.com/base/feeds/snippets/5693149482483031630,quark xpress 7 (no returns),b000kgg6ru,quarkxpress 7 ( windows & macintosh )
http://www.google.com/base/feeds/snippets/5707639507589635432,microspot macdraft pe personal edition,b00078x3hm,microspot macdraft pe (mac)
http://www.google.com/base/feeds/snippets/5536147337142384196,adobe indesign cs3 for mac,b000ndibci,adobe indesign cs3 [mac]
http://www.google.com/base/feeds/snippets/5527718669808727624,microsoft virtual pc 7.0 windows xp home,b0002nt5ho,microsoft virtual pc for mac 7.0 with windows xp home
http://www.google.com/base/feeds/snippets/5615075942724114350,aspyr sims 2 nightlife expansion pack,b000ecqxjq,sims 2 nightlife expansion pack
http://www.google.com/base/feeds/snippets/5364807314885028760,git 40 years of marvel avengers dvd-rom,b000fjsa2g,40 years of the avengers
http://www.google.com/base/feeds/snippets/5310740648374994867,aquaminds notetaker,b0000azvvs,notetaker 1.5
http://www.google.com/base/feeds/snippets/5562499905130838466,micromat techtool protogo,b00013wgz8,micromat techtool pro 4 (mac)
http://www.google.com/base/feeds/snippets/5521627113113350450,adobe cs3 master collection academic,b000ndibkk,adobe creative suite cs3 master collection upgrade [mac]
http://www.google.com/base/feeds/snippets/5520835678868977029,allume internet cleanup 3.0,b000a2aknu,internet cleanup 3.0
http://www.google.com/base/feeds/snippets/5505866551596188643,destineer rise of nations gold edition,b000hzrlim,age of empires iii
http://www.google.com/base/feeds/snippets/7147648211015076337,git 44 years of marvel fantastic 4 dvd-rom,b000edgo2q,44 years of the fantastic four
http://www.google.com/base/feeds/snippets/7150077051864937455,microspot interiors version 3.6,b000jx3qxq,microspot interiors
http://www.google.com/base/feeds/snippets/6645838516644564026,ages of empires iii,b000hzrlim,age of empires iii
http://www.google.com/base/feeds/snippets/6176694480450258174,marware project x project management software,b000qclgqo,project x project management software
http://www.google.com/base/feeds/snippets/4295762370065792405,brighter minds diner dash,b000bs5icq,diner dash (pc & mac)
http://www.google.com/base/feeds/snippets/4282890852330556387,rollercoaster tycoon 3 soaked,b000n5meva,rollercoaster tycoon 3: soaked
http://www.google.com/base/feeds/snippets/4287560991242110323,adobe cs3 flash professional,b000ndicpy,adobe flash pro cs3 [mac]
http://www.google.com/base/feeds/snippets/4233168214815079628,aspyr lego star wars ii,b0007znn48,lego star wars (dvd) (mac)
http://www.google.com/base/feeds/snippets/4247841323668156699,adobe cs3 master collection upsell from cs2,b000ndibkk,adobe creative suite cs3 master collection upgrade [mac]
http://www.google.com/base/feeds/snippets/4224056639442959853,adobe cs3 after effects,b000ogsgym,adobe after effects cs3
http://www.google.com/base/feeds/snippets/4142751275091158911,aspyr star wars empire at war,b000lrdlia,star wars empire at war (intel only macs)
http://www.google.com/base/feeds/snippets/4178014773187756948,apple garageband jam pack: symphony orchestra,b0008glgrm,apple garageband jam pack: symphony orchestra
http://www.google.com/base/feeds/snippets/4058027556169196919,adobe illustrator cs3 for mac academic,b000ndib96,adobe illustrator cs3 upgrade [mac]
http://www.google.com/base/feeds/snippets/3987571280945693014,avanquest encyclopedia britannica 2006,b000qfqa1w,encyclopedia britannica deluxe 2008 win/mac
http://www.google.com/base/feeds/snippets/3997486488729671932,mariner calc spreadsheet software,b00007eegy,mariner calc speadsheet (mac)
http://www.google.com/base/feeds/snippets/3907261301303045278,adobe photoshop lightroom,b000ndib7s,adobe photoshop cs3 upgrade [mac]
http://www.google.com/base/feeds/snippets/3911347389465432711,adobe acrobat v8.0 professional for mac academic,b000kipk02,acrobat pro 8 mac ed 1u cd
http://www.google.com/base/feeds/snippets/3904233865329859068,filemaker pro 8.5 upgrade,b000b7pkio,filemaker mobile 8 for palm os and pocket pc
http://www.google.com/base/feeds/snippets/3626343668255224722,adobe acrobat v8.0 professional for mac upgrade,b000e8jlas,adobe audition 2.0 upgrade
http://www.google.com/base/feeds/snippets/3621810113236094380,adobe cs3 design standard upgrade windows,b000ub6avc,adobe cs3 design standard macosx dvd
http://www.google.com/base/feeds/snippets/3607173973836413689,adobe cs3 design premium upsell,b000ndick4,adobe creative suite cs3 design premium upsell
http://www.google.com/base/feeds/snippets/3517623052530241119,aspyr simcity 4 deluxe,b000exw524,sims complete
http://www.google.com/base/feeds/snippets/3473826515983580841,adobe photoshop cs3 for mac upgrade,b000ndib7s,adobe photoshop cs3 upgrade [mac]
http://www.google.com/base/feeds/snippets/5181661570525386541,adobe premiere pro cs3 upgrade,b000o24l3q,adobe premiere pro cs3 upgrade
http://www.google.com/base/feeds/snippets/5196111013090642318,symantec norton anti-virus 10 mac 5 user pack,b000t9luce,norton internet security 2008 10 user
